{
  "version": 1,
  "dependency_lock": {
    "path": "requirements.server.txt",
    "sha256": "2b531ef1b5494577c3994abfc429dc78f5fbb3f4161b2b89c659cfd77ac72ad5"
  },
  "runtime_manifest": {
    "governance_modes": [
      "strict",
      "audit"
    ],
    "deterministic_provider_required": true,
    "mutable_filesystem": {
      "disable_env": "ADAAD_DISABLE_MUTABLE_FS",
      "allowlist_env": "ADAAD_MUTABLE_FS_ALLOWLIST",
      "allowlist": [
        "reports",
        "security/ledger",
        "security/replay_manifests",
        "experiments/branches"
      ]
    },
    "network": {
      "disable_env": "ADAAD_DISABLE_NETWORK",
      "allowlist_env": "ADAAD_NETWORK_ALLOWLIST",
      "allowlist": [
        "127.0.0.1",
        "api.github.com",
        "localhost"
      ]
    }
  },
  "agents": {
    "grok-integrator": {
      "enabled": false,
      "provider": "xai",
      "profile": "governance-observer",
      "metadata": {
        "migration": "schema-aware-default",
        "notes": "Reserved for future grok bridge activation; ignored when disabled."
      }
    }
  }
}
